flashcard_index,flashcard_question,flashcard_answer,flashcard_keyword,flashcard_topic
3,What is physiologic Atrophy?,It's a natural process of aging that affects various body parts like the breast and uterus.,"['Atrophy', 'aging', 'breast', 'uterus']",Physiologic Atrophy
4,What causes Pathologic Atrophy?,"Common causes include decreased workload (disuse), loss of innervation (denervation), diminished blood supply (ischemia), inadequate nutrition, and loss of endocrine stimulation.","['Atrophy', 'pathologic', 'causes']",Pathologic Atrophy
5,What is Decreased Workload Atrophy?,It occurs when there's a lack of use in a limb or organ.,"['Atrophy', 'decreased workload']",Decreased Workload Atrophy
6,What is Loss of Innervation Atrophy?,It occurs when a nerve no longer sends signals to the muscle or organ.,"['Atrophy', 'loss of innervation']",Loss of Innervation Atrophy
7,What is Diminished Blood Supply Atrophy?,It occurs when the blood flow to a muscle or organ is reduced.,"['Atrophy', 'diminished blood supply']",Diminished Blood Supply Atrophy
8,What is Inadequate Nutrition Atrophy?,It occurs when the body part or organ doesn't receive enough nutrients.,"['Atrophy', 'inadequate nutrition']",Inadequate Nutrition Atrophy
9,What is Loss of Endocrine Stimulation Atrophy?,It occurs when a gland stops producing hormones that stimulate growth.,"['Atrophy', 'loss of endocrine stimulation']",Loss of Endocrine Stimulation Atrophy
10,What is Pressure Atrophy?,It occurs when there's constant pressure on a body part or organ.,"['Atrophy', 'pressure']",Pressure Atrophy
1,What are the mechanisms of Atrophy?,"Atrophy is caused by decreased protein synthesis and increased protein degradation in cells. The Ubiquitin-proteasome pathway plays a role in protein degradation, and there is an increase in autophagy.","['Atrophy', 'Protein synthesis', 'Protein degradation', 'Ubiquitin-proteasome pathway', 'Autophagy']",Atrophy
2,What leads to decreased protein synthesis in Atrophy?,Decreased protein synthesis is a mechanism of Atrophy.,"['Atrophy', 'Protein synthesis']",Atrophy Mechanisms
3,What role does the Ubiquitin-proteasome pathway play in Atrophy?,The Ubiquitin-proteasome pathway plays a role in protein degradation during Atrophy.,"['Atrophy', 'Ubiquitin-proteasome pathway']",Atrophy Mechanisms
4,What is increased in Atrophy?,Protein degradation and autophagy are increased during Atrophy.,"['Atrophy', 'Protein degradation', 'Autophagy']",Atrophy Mechanisms
5,What is Senile Atrophy?,Senile Atrophy is a type of Atrophy.,"['Atrophy', 'Senile Atrophy']",Senile Atrophy
1,What type of change is metaplasia?,Metaplasia is a reversible change in which one differentiated cell type is replaced by another.,"['change', 'reversible', 'cell type']",Reversible change
2,Which two types of cells are involved in metaplasia?,"One differentiated cell type is replaced by another. For example, columnar epithelial cells can be replaced by squamous cells.","['cells', 'replaced', 'epithelial', 'mesenchymal']",Types of cell replacement
3,What is the most common form of metaplasia?,The most common form of metaplasia is squamous metaplasia.,"['metaplasia', 'common', 'squamous']",Common type of metaplasia
4,What can happen if metaplasia persists?,"If metaplasia persists, it may initiate malignant transformation in the metaplastic epithelium.","['metaplasia', 'persist', 'malignant transformation']",Consequences of persistent metaplasia
5,How does metaplasia occur?,Metaplasia occurs through the reprogramming of stem cells that exist in normal tissue or of undifferentiated mesenchymal cells present in connective tissue.,"['metaplasia', 'occur', 'stem cells', 'mesenchymal cells']",Mechanism of metaplasia
6,What is metaplasia?,Metaplasia is a reversible change in which one differentiated cell type is replaced by another.,['metaplasia'],Metaplasia definition
1,What are the intracellular components that can accumulate?,"Lipids (Steatosis, Cholesterol and cholesterol esters), Proteins, Hyaline change, Glycogen, and Pigments (Exogenous and Endogenous)","['Intracellular', 'Accumulation', 'Lipids', 'Proteins', 'Hyaline change', 'Glycogen', 'Pigments', 'Exogenous', 'Endogenous']",Intracellular Accumulation
2,Which intracellular component is a type of fatty change?,Steatosis,"['Intracellular', 'Accumulation', 'Steatosis']",Intracellular Accumulation
3,Which intracellular components are proteins?,Proteins,"['Intracellular', 'Accumulation', 'Proteins']",Intracellular Accumulation
4,What is Hyaline change?,Hyaline change is a type of intracellular accumulation.,"['Intracellular', 'Accumulation', 'Hyaline change']",Intracellular Accumulation
5,Which intracellular component is a type of carbohydrate?,Glycogen,"['Intracellular', 'Accumulation', 'Glycogen']",Intracellular Accumulation
6,What is one manifestation of metabolic derangements in cells?,One of the manifestations of metabolic derangements in cells is intracellular accumulation.,"['Intracellular', 'Accumulation', 'Metabolic derangements']",Intracellular Accumulation
1,Which condition is characterized by the buildup of plaque in the intimal layer of aorta and large arteries?,Atherosclerosis,"['atherosclerosis', 'intimal layer']",Atherosclerosis
2,In which part of the skin is xanthomas found?,Xanthomas are found in the subepithelial connective tissue of the skin.,"['xanthomas', 'skin']",Xanthomas
3,Where is cholesterolosis found?,Cholesterolosis is found in the lamina propria of the gallbladder.,"['cholesterolosis', 'gallbladder']",Cholesterolosis
4,"What is Niemann-Pick disease, type C?","Niemann-Pick disease, type C is a lysosomal storage disease.","['Niemann-Pick disease', 'type C', 'lysosomal storage disease']","Niemann-Pick disease, type C"
5,What are foam cells?,Foam cells are macrophages.,"['foam cells', 'macrophages']",Foam cells
1,What are Russell bodies?,Russell bodies are intracellular inclusions found in plasma cells.,"['Russell bodies', 'plasma cells']",Proteins
2,What happens when there is synthesis of excessive amounts of normal secretory protein?,Russell bodies are formed.,"['protein synthesis', 'excessive amounts']",Proteins
3,What occurs when there is a defective intracellular transport and secretion of critical proteins?,Proteins accumulate in the cell.,"['intracellular transport', 'secretion', 'proteins']",Proteins
4,Which proteins accumulate in alcoholic hyaline?,Cytoskeletal proteins such as keratin.,"['alcoholic hyaline', 'cytoskeletal proteins']",Proteins
5,What are neurofibrillary tangles made of?,They are made up of neurofilaments.,"['neurofibrillary tangles', 'neurofilament']",Proteins
6,What happens when abnormal folded proteins aggregate?,They form amyloidosis.,"['abnormal folded proteins', 'amyloidosis']",Proteins
1,What are pigments?,Pigments are substances that change the color of other materials.,['pigments'],Pigments
2,What are exogenous pigments? Give examples.,Exogenous pigments are obtained from outside sources. Examples include carbon (coal dust) and anthracosis.,"['exogenous pigments', 'carbon', 'anthracosis']",Exogenous Pigments
3,What is another example of an exogenous pigment?,Tattooing involves the use of exogenous pigments.,"['exogenous pigments', 'tattooing']",Exogenous Pigments
4,How are carbon (coal dust) and anthracosis used as pigments?,They are used as exogenous pigments.,"['carbon', 'anthracosis', 'pigments']",Carbon and Anthracosis as Pigments
5,What is the ratio of carbon to anthracosis in exogenous pigments?,The ratio is 6:4.,"['exogenous pigments', 'carbon', 'anthracosis', 'ratio']",Exogenous Pigments Ratio
1,What is Lipofuscin?,Lipofuscin is an endogenous pigment associated with wear-and-tear or aging.,"['Lipofuscin', 'endogenous pigment', 'wear-and-tear']",Endogenous Pigments
2,What is the function of Lipofuscin?,Lipofuscin functions as a pigment in the body.,"['Lipofuscin', 'pigment']",Endogenous Pigments
3,What is Hemosiderin?,Hemosiderin is an endogenous pigment related to hemosiderosis.,"['Hemosiderin', 'endogenous pigment', 'hemosiderosis']",Endogenous Pigments
4,What is the role of Melanin?,Melanin is an endogenous pigment responsible for brown atrophy.,"['Melanin', 'endogenous pigment', 'atrophy']",Endogenous Pigments
1,What is dystrophic calcification?,Dystrophic calcification is a type of abnormal tissue deposition of calcium salts.,"['dystrophic calcification', 'abnormal tissue deposition', 'calcium salts']",Pathologic Calcification
2,What causes dystrophic calcification?,Dystrophic calcification occurs in areas of necrosis.,"['dystrophic calcification', 'necrosis']",Pathologic Calcification
3,Where can dystrophic calcification be found?,"Dystrophic calcification can be found in atherosclerotic arteries, damaged heart valves, and necrotic tumors.","['dystrophic calcification', 'atherosclerotic arteries', 'damaged heart valves', 'necrotic tumors']",Pathologic Calcification
4,What is a Psammoma body?,A Psammoma body is a type of round or oval calcified structure found in various tissues.,"['Psammoma body', 'calcified structure']",Pathologic Calcification
1,What conditions can lead to metastatic calcification?,"Metastatic calcification can occur due to hyperparathyroidism, destruction of bone tissue, vitamin D-related disorders, and renal failure.","['metastatic calcification', 'hyperparathyroidism', 'destruction of bone tissue', 'vitamin D-related disorders', 'renal failure']",Metastatic Calcification
2,Where can metastatic calcification occur in the body?,"Metastatic calcification can occur widely throughout the body, including interstitial tissues of the gastric mucosa, kidneys, lungs, systemic arteries, and pulmonary vein.","['metastatic calcification', 'gastric mucosa', 'kidneys', 'lungs', 'systemic arteries', 'pulmonary vein']",Metastatic Calcification
3,What is nephrocalcinosis?,Nephrocalcinosis is a condition where metastatic calcification occurs in the kidneys.,"['nephrocalcinosis', 'kidneys']",Metastatic Calcification in Kidneys
4,What is pathologic calcification?,Pathologic calcification refers to the abnormal deposition of calcium salts in tissues.,['pathologic calcification'],Pathologic Calcification
1,What is cellular aging?,A progressive decline in cellular function and viability caused by genetic abnormalities and the accumulation of cellular and molecular damage due to exposure to exogenous influences.,"['Cellular Aging', 'Decline', 'Function', 'Viability', 'Genetic Abnormalities']",Cellular Aging
2,Why does cellular aging occur?,Cellular aging occurs due to genetic abnormalities and the accumulation of cellular and molecular damage caused by exposure to exogenous influences.,"['Cellular Aging', 'Genetic Abnormalities', 'Accumulation', 'Exposure', 'Exogenous Influences']",Cellular Aging
3,What are the causes of cellular aging?,Cellular aging is caused by genetic abnormalities and the accumulation of cellular and molecular damage due to exposure to exogenous influences.,"['Cellular Aging', 'Genetic Abnormalities', 'Accumulation', 'Exposure']",Cellular Aging
4,How does cellular aging affect cells?,Cellular aging results in a decline in cellular function and viability.,"['Cellular Aging', 'Decline', 'Function', 'Viability']",Cellular Aging
5,What are the two main factors contributing to cellular aging?,The two main factors contributing to cellular aging are genetic abnormalities and exposure to exogenous influences.,"['Cellular Aging', 'Genetic Abnormalities', 'Exposure', 'Exogenous Influences']",Cellular Aging
6,What is the result of the accumulation of cellular and molecular damage in cells?,The result of the accumulation of cellular and molecular damage in cells is a decline in cellular function and viability.,"['Cellular Aging', 'Accumulation', 'Cellular Damage', 'Molecular Damage', 'Decline']",Cellular Aging
7,What are the two types of damage that contribute to cellular aging?,The two types of damage that contribute to cellular aging are genetic abnormalities and damage caused by exposure to exogenous influences.,"['Cellular Aging', 'Genetic Abnormalities', 'Exposure', 'Exogenous Influences']",Cellular Aging
1,What are telomeres?,Telomeres are the protective caps at the end of chromosomes that prevent the loss of genetic information during cell division.,"['telomeres', 'protective caps']",Telomeres
2,What is the role of telomerase in cells?,"Telomerase is an enzyme that adds new telomere repeats to the ends of chromosomes, maintaining their length and preventing cellular aging.","['telomerase', 'enzyme']",Telomerase
3,What is replicative senescence?,Replicative senescence is the process by which cells can no longer divide and grow due to the shortening of their telomeres.,['replicative senescence'],Replicative Senescence
4,How are telomeres related to replicative senescence?,"The shortening of telomeres during cell division triggers replicative senescence, preventing the cell from dividing further.","['telomeres', 'replicative senescence']",Telomeres and Replicative Senescence
5,Why is the maintenance of telomeres and telomerase important for cells?,"The maintenance of telomeres and telomerase is essential for cells to maintain their ability to divide and grow, preventing cellular aging and senescence.","['telomeres', 'telomerase', 'cellular aging']",Importance of Telomeres and Telomerase
1,What happens to cells when they are stressed beyond their tolerance level?,Cell injury (reversible or irreversible) develops.,"['cell injury', 'stress']",Cell Injury
2,What is the outcome of irreversible cell injury?,Necrosis is the result.,"['irreversible injury', 'necrosis']",Irreversible Cell Injury
3,What are the specific patterns of necrosis?,"Coagulative, liquefactive, gangrenous, caseous, fat, and fibrinoid are the types.","['necrosis', 'types']",Types of Necrosis
4,What is apoptosis?,Apoptosis is individual cell death.,['apoptosis'],Apoptosis
5,How does apoptosis occur?,"It is characterized by enzymatic degradation of proteins and DNA, initiated by caspases, and the recognition and removal of dead cells by phagocytes.","['apoptosis', 'mechanisms']",Mechanisms of Apoptosis
6,What are the mechanisms that cause cell injury?,"Hypoxia and ischemia lead to ATP depletion, ischemia-reperfusion injury, oxidative stress, protein misfolding, DNA damage, mitochondrial dysfunction, and membrane damage.","['cell injury', 'mechanisms']",Cell Injury Mechanisms
1,What are adaptations in biology?,"Adaptations are reversible changes in the size, number, phenotype, or functions of cells in response to changes in their environment.",,Adaptations
2,What causes abnormal deposits of materials in cells and tissues?,Abnormal deposits of materials in cells and tissues are the result of excessive intake or defective transport or catabolism.,,Abnormal Deposits
3,What is pathologic calcification?,Pathologic calcification is the abnormal tissue deposition of calcium salts.,,Pathologic Calcification
4,What causes cellular aging?,"Cellular aging results from a combination of accumulating cellular damage, reduced capacity to divide, and reduced ability to repair damaged DNA.",,Cellular Aging
